{
  "schema_version": "2.0",
  "run_id": "gh-122",
  "flow": "review",
  "completion": "PARTIAL",
  "verification": "VERIFIED",
  "generated_at": "2026-08-29T06:25:00Z",
  "summary": "Six of eight review items were resolved and rechecked; two bounded items remain.",
  "missing_required": [],
  "blockers": ["Two review worklist items remain open."],
  "concerns": [],
  "evidence": [
    {
      "kind": "review-worklist",
      "path": ".runs/gh-122/review/review_worklist.md",
      "sha256": "bbbbbbbbbbbbbbbbbbbbbbbbbbbbbbbbbbbbbbbbbbbbbbbbbbbbbbbbbbbbbbbb",
      "observed_at": "2026-08-29T06:24:45Z"
    }
  ],
  "metrics": {
    "items_total": 8,
    "items_resolved": 6
  }
}
